{"media_id":"22222222-2222-4222-8222-222222222222","owner_sub":"user-123","sha256":"aaaaaaaaaaaaaaaaaaaaaaaaaaaaaaaaaaaaaaaaaaaaaaaaaaaaaaaaaaaaaaaa","file_name":"cassowary.jpg","media_type":"image","original_storage_uri":"s3://pacific-media/originals/aaaaaaaa/cassowary.jpg","thumbnail_storage_uri":"s3://pacific-media/derived/aaaaaaaa/thumbnail.jpg","tag_counts":{"Casuarius_casuarius":2},"manual_tags":[],"model_version":"speciesnet-1.0.0","status":"ready","created_at":"2026-08-22T04:00:00Z","updated_at":"2026-08-22T04:01:00Z"}
